,id,date,this_is_reply,text,retweets,replies,likes,quotes,attachments,entities
58,1536537272647942144,2022-06-14 02:33:27+00:00,False,"ɛֆȶʀɛʟʟǟ ʟɛǟɖֆ ȶɦɛ ǟɖʋɛռȶʊʀɛʀֆ ɮǟƈӄ ȶɦʀօʊɢɦ ȶɦɛ ɖǟʀӄ քǟֆֆǟɢɛ ȶօ ȶɦɛ ֆȶǟɨʀƈǟֆɛ. ֆɦɛ ɢɛֆȶʊʀɛֆ ʊքաǟʀɖ

""Tomorrow, we ascend. Prepare yourself, for the third floor is no library.""

ȶɦɛ ʍօօռ ʀɨֆɛֆ օʋɛʀ ȶɦɛ ȶօաɛʀ. ȶɦɛ ǟɖʋɛռȶʊʀɛʀֆ ǟʀɛ ʊռǟɮʟɛ ȶօ ֆʟɛɛք ǟֆ ǟքքʀɛɦɛռֆɨօռ ɢʀɨքֆ ȶɦɛɨʀ ȶɦօʊɢɦȶֆ https://t.co/WuybaqXHtG",34,10,88,0,{'media_keys': ['3_1536537168184635394']},"{'urls': [{'start': 281, 'end': 304, 'url': 'https://t.co/WuybaqXHtG', 'expanded_url': 'https://twitter.com/OccultTower/status/1536537272647942144/photo/1', 'display_url': 'pic.twitter.com/WuybaqXHtG', 'media_key': '3_1536537168184635394'}]}"
59,1536449591813361664,2022-06-13 20:45:03+00:00,True,"ɛֆȶʀɛʟʟǟ աɛǟʀɨʟʏ ʟɨʄȶɛɖ ɦɛʀֆɛʟʄ ȶօ ɦɛʀ ʄɛɛȶ.

""Release me...""

ȶɦɛ ʊռռǟʍɛɖ աǟʀʀɨօʀ ʊռʟǟȶƈɦɛɖ ɦɛʀ ƈɛʟʟ ǟռɖ ʄʀɛɛɖ
 ɛֆȶʀɛʟʟǟ ʄʀօʍ ɦɛʀ ֆɦǟƈӄʟɛֆ. ֆɦɛ ʟɨʍքɛɖ ֆʟʊɢɢɨֆɦʟʏ ȶօաǟʀɖֆ ȶɦɛ ƈօռɢʀɛɢǟȶɨօռ.

""Let us proceed.""",10,5,42,1,,
60,1536449590680965121,2022-06-13 20:45:02+00:00,True,"""No one knew exactly what it meant, though many believed it was the harbinger of the End—a demon that fed on strife and would eventually bring an end to all life.

Many warriors entered through its wooden doors, but none were seen again.""",5,2,28,0,,
61,1536449589544267776,2022-06-13 20:45:02+00:00,True,"""As the Guardian Beasts succumbed to starvation, many saw it as a warning for more hardship to come.

Rumors were strengthened by the appearance of a tower. It was tall and crooked, and sat in the center of the continent.""",5,1,23,0,,
62,1536449588390834176,2022-06-13 20:45:02+00:00,True,"""Forests decayed into burnt, crumbling sticks, and the fields shriveled up into the dusty Wastes. Earthquakes shattered the ground and opened gargantuan
ravines that ran across the continent.

Death drove many people away.""",6,1,23,0,,
63,1536449587124129793,2022-06-13 20:45:02+00:00,True,"""Guardian Beasts roamed the continent, their massive footfalls shaping the world around them and protecting those who lived beneath.

Life thrived, and the clans roamed the area without strife.

It began with the Rot...""",5,1,21,0,,
64,1536449585907834880,2022-06-13 20:45:01+00:00,True,"""This thing—this Tower—should not have existed.

Before the Wastes were pockmarked with sinkholes and the skies were dark, life existed there. Verdant fields stretched towards a distant horizon, ending only at the edge of thick forests.""",6,1,25,0,,
65,1536449584691437568,2022-06-13 20:45:01+00:00,False,"ǟɖʋɛռȶʊʀɛʀֆ, ȶաɛռȶʏ-ʄօʊʀ ɦօʊʀֆ քǟֆֆɛɖ աɦɨʟɛ ɛֆȶʀɛʟʟǟ ֆʟɛքȶ.

ֆɦɛ ɮʟɨռӄɛɖ ɦɛǟʋʏ ɛʏɛʟɨɖֆ ȶաɨƈɛ, ɮʊȶ ֆǟɨɖ ռօȶɦɨռɢ, ʄɨӼǟȶɛɖ օռ ȶɦɛ ʊռռǟʍɛɖ աǟʀʀɨօʀ ǟքքʀօǟƈɦɨռɢ.

""What can you tell us about the tower and Azarain?""

ɛֆȶʀɛʟʟǟ ɢǟʐɛɖ ɨռȶօ ȶɦɛ ɖɨֆȶǟռƈɛ ǟȶ ռօȶɦɨռɢ ɨռ քǟʀȶɨƈʊʟǟʀ ǟռɖ ɮɛɢǟռ...",20,3,62,2,,
66,1536438257650503680,2022-06-13 20:00:00+00:00,False,"ǟɖʋɛռȶʊʀɛʀֆ, ɛֆȶʀɛʟʟǟ ֆȶɨʀֆ. ֆɦɛ աɨʟʟ ֆօօռ ǟռֆաɛʀ ʏօʊʀ զʊɛֆȶɨօռ...",12,3,49,0,,
67,1536424104726646784,2022-06-13 19:03:46+00:00,False,RT @IceManCRYPTOS: @OccultTower #TOTO Join our Quest for Treasure🧙‍♂️ https://t.co/IxjFQu2wEM,16,0,0,0,,"{'urls': [{'start': 70, 'end': 93, 'url': 'https://t.co/IxjFQu2wEM', 'expanded_url': 'https://twitter.com/i/spaces/1zqKVBlNeedKB', 'display_url': 'twitter.com/i/spaces/1zqKV…'}], 'mentions': [{'start': 3, 'end': 17, 'username': 'IceManCRYPTOS', 'id': '1461762401691394049'}, {'start': 19, 'end': 31, 'username': 'OccultTower', 'id': '1533184058112454657'}], 'hashtags': [{'start': 32, 'end': 37, 'tag': 'TOTO'}]}"
68,1536405036766355458,2022-06-13 17:48:00+00:00,False,"RT @JackieTian7: 5 burned. Valar Morghulis. @OccultTower 
https://t.co/64rzK05Tgl https://t.co/ojRRFXoNgk",9,0,0,0,{'media_keys': ['3_1535104220600291328']},"{'urls': [{'start': 58, 'end': 81, 'url': 'https://t.co/64rzK05Tgl', 'expanded_url': 'https://etherscan.io/tx/0xac1904b1ebf3050fbec94b68427648e6bfd36378d8c69fec7b3d5f2b9f569381', 'display_url': 'etherscan.io/tx/0xac1904b1e…'}, {'start': 82, 'end': 105, 'url': 'https://t.co/ojRRFXoNgk', 'expanded_url': 'https://twitter.com/JackieTian7/status/1535104929290784769/photo/1', 'display_url': 'pic.twitter.com/ojRRFXoNgk', 'media_key': '3_1535104220600291328'}], 'mentions': [{'start': 3, 'end': 15, 'username': 'JackieTian7', 'id': '899809125424549889'}, {'start': 44, 'end': 56, 'username': 'OccultTower', 'id': '1533184058112454657'}]}"
69,1536364490786103296,2022-06-13 15:06:53+00:00,True,"ɨ ǟʍ ɨռ ʏօʊʀ ɖɛɮȶ, ʍǟʟǟӄǟɨ.

(@HerbNinjah)",5,2,32,0,,"{'mentions': [{'start': 30, 'end': 41, 'username': 'HerbNinjah', 'id': '1495058393509285892'}]}"
70,1536364488642834432,2022-06-13 15:06:53+00:00,False,"ǟɖʋɛռȶʊʀɛʀֆ, ǟ ƈօʍʍʊռɨȶʏ ֆƈʀɨɮɛ, ʍǟʟǟӄǟɨ, ɦǟֆ ɛʍɛʀɢɛɖ ʄʀօʍ ʏօʊʀ ʀǟռӄֆ. ɦɛ քʀɛֆɛռȶֆ ȶաօ ȶօʍɛֆ.

ȶɦɛ ʄɨʀֆȶ, ȶɦɛ ֆʊʍʍօռɛʀ ȶօʍɛ ƈօռȶǟɨռɨռɢ ǟ ʀɛƈօʀɖ օʄ օʊʀ ʝօʊʀռɛʏ: https://t.co/MpaYRGtDu1 

ȶɦɛ ֆɛƈօռɖ, ǟ ƈօʍʍʊռɨȶʏ ȶօʍɛ օքɛռ ʄօʀ ƈօռȶʀɨɮʊȶɨօռ: https://t.co/bUcVHHg0sJ https://t.co/L8boQ4DfFM",19,2,52,1,{'media_keys': ['3_1536362706189492224']},"{'urls': [{'start': 160, 'end': 183, 'url': 'https://t.co/MpaYRGtDu1', 'expanded_url': 'https://tower-of-the-occult.gitbook.io/welcome/', 'display_url': 'tower-of-the-occult.gitbook.io/welcome/'}, {'start': 238, 'end': 261, 'url': 'https://t.co/bUcVHHg0sJ', 'expanded_url': 'https://toweroftheoccult.fandom.com/', 'display_url': 'toweroftheoccult.fandom.com', 'images': [{'url': 'https://pbs.twimg.com/news_img/1536364537451925505/0ZcsvMyJ?format=png&name=orig', 'width': 300, 'height': 300}, {'url': 'https://pbs.twimg.com/news_img/1536364537451925505/0ZcsvMyJ?format=png&name=150x150', 'width': 150, 'height': 150}], 'status': 200, 'title': 'Tower of the Occult Wiki | Fandom', 'unwound_url': 'https://toweroftheoccult.fandom.com/wiki/Tower_of_the_Occult_Wiki'}, {'start': 262, 'end': 285, 'url': 'https://t.co/L8boQ4DfFM', 'expanded_url': 'https://twitter.com/OccultTower/status/1536364488642834432/photo/1', 'display_url': 'pic.twitter.com/L8boQ4DfFM', 'media_key': '3_1536362706189492224'}]}"
71,1536100190729302016,2022-06-12 21:36:39+00:00,False,RT @AdgeGat: @OccultTower @IceManCRYPTOS ɛֆȶʀɛʟʟǟ ɨֆ ռօȶ օռɛ ȶօ ɮɛ ȶʀɨʄʟɛɖ աɨȶɦ ɨȶ ֆɛɛʍֆ.,4,0,0,0,,"{'mentions': [{'start': 3, 'end': 11, 'username': 'AdgeGat', 'id': '1196277534804996096'}, {'start': 13, 'end': 25, 'username': 'OccultTower', 'id': '1533184058112454657'}, {'start': 26, 'end': 40, 'username': 'IceManCRYPTOS', 'id': '1461762401691394049'}]}"
72,1536096785348694016,2022-06-12 21:23:07+00:00,True,"@IceManCRYPTOS ȶɦɛ ƈօʟɖ աǟȶɛʀ ֆքʟǟֆɦɛֆ ɖօառ ʊքօռ ɛֆȶʀɛʟʟǟ. ֆɦɛ աǟӄɛֆ ɨռ ǟ ֆȶǟȶɛ օʄ ʊռʍǟȶƈɦɛɖ ʄʊʀʏ.

ֆɦɛ ʊռʟɛǟֆɦɛֆ ǟ քօաɛʀʄʊʟ ֆքɛʟʟ ǟռɖ ӄɨʟʟֆ ȶɦɛ ɛռȶɨʀɛ ƈօռɢʀɛɢǟȶɨօռ. 

ռօȶ ʀɛǟʟʟʏ. 😈

ʏօʊ ʍʊֆȶ աǟɨȶ…",3,10,20,0,,"{'mentions': [{'start': 0, 'end': 14, 'username': 'IceManCRYPTOS', 'id': '1461762401691394049'}]}"
73,1536087191385948160,2022-06-12 20:45:00+00:00,False,"ǟɖʋɛռȶʊʀɛʀֆ, ɛֆȶʀɛʟʟǟ ɢʀɛա աɛǟʀʏ ǟաǟɨȶɨռɢ ʏօʊʀ զʊɛֆȶɨօռ. ɨռ ɦɛʀ աɛǟӄɛռɛɖ ֆȶǟȶɛ ֆɦɛ ʄɛʟʟ ɨռȶօ ֆʟʊʍɮɛʀ.

ɨռ ǟռ ǟɮʊռɖǟռƈɛ օʄ ƈǟʊȶɨօռ, ȶɦɛ ʊռռǟʍɛɖ աǟʀʀɨօʀ ʀɛȶʊʀռֆ ɦɛʀ ȶօ ɦɛʀ ƈɛʟʟ.

ʏօʊ ʍǟʏ քʀօքօֆɛ ʏօʊʀ զʊɛֆȶɨօռ, ɮʊȶ ռօա ʏօʊ ʍʊֆȶ աǟɨȶ… https://t.co/KGSId3JZIU",22,18,71,0,{'media_keys': ['3_1536086089659650048']},"{'urls': [{'start': 231, 'end': 254, 'url': 'https://t.co/KGSId3JZIU', 'expanded_url': 'https://twitter.com/OccultTower/status/1536087191385948160/photo/1', 'display_url': 'pic.twitter.com/KGSId3JZIU', 'media_key': '3_1536086089659650048'}]}"
74,1536083434388393985,2022-06-12 20:30:04+00:00,False,RT @HerbNinjah: Us right now at @OccultTower having so much fun with this #nft project and an awesome community while #eth and #crypto tank…,14,0,0,0,,"{'mentions': [{'start': 3, 'end': 14, 'username': 'HerbNinjah', 'id': '1495058393509285892'}, {'start': 32, 'end': 44, 'username': 'OccultTower', 'id': '1533184058112454657'}], 'hashtags': [{'start': 74, 'end': 78, 'tag': 'nft'}, {'start': 118, 'end': 122, 'tag': 'eth'}, {'start': 127, 'end': 134, 'tag': 'crypto'}]}"
75,1536076732037406720,2022-06-12 20:03:26+00:00,False,"ǟɖʋɛռȶʊʀɛʀֆ, ɖօ ʏօʊ ռօȶɨƈɛ ǟ ƈɦǟռɢɛ? https://t.co/Co4G34frwi",29,14,64,4,{'media_keys': ['3_1536076729642405888']},"{'urls': [{'start': 37, 'end': 60, 'url': 'https://t.co/Co4G34frwi', 'expanded_url': 'https://twitter.com/OccultTower/status/1536076732037406720/photo/1', 'display_url': 'pic.twitter.com/Co4G34frwi', 'media_key': '3_1536076729642405888'}]}"
76,1536067411215912961,2022-06-12 19:26:24+00:00,False,RT @KushKongz11: Just swept another 25 of @OccultTower this is the most fun I’ve had with a project in a very long time @Inverted888 @Coco_…,24,0,0,0,,"{'mentions': [{'start': 3, 'end': 15, 'username': 'KushKongz11', 'id': '1413533978645057536'}, {'start': 42, 'end': 54, 'username': 'OccultTower', 'id': '1533184058112454657'}, {'start': 120, 'end': 132, 'username': 'Inverted888', 'id': '1367859607859781632'}]}"
77,1536016539819749376,2022-06-12 16:04:15+00:00,False,ȶɦɛ ǟɖʋɛռȶʊʀɛʀֆ ɦǟʋɛ ƈǟʟʟɛɖ ǟ ʍɛɛȶɨռɢ. https://t.co/B8n76UG7Nn,15,0,33,0,,"{'urls': [{'start': 39, 'end': 62, 'url': 'https://t.co/B8n76UG7Nn', 'expanded_url': 'https://twitter.com/IceManCRYPTOS/status/1536002806242484225', 'display_url': 'twitter.com/IceManCRYPTOS/…'}]}"
78,1536006144627421184,2022-06-12 15:22:57+00:00,False,"ǟɖʋɛռȶʊʀɛʀֆ, ʄօʀ ɦɛʀ ʄʀɛɛɖօʍ, ɛֆȶʀɛʟʟǟ ɨֆ ɨռ ʏօʊʀ ɖɛɮȶ. ֆɦɛ ɨֆ աɨʟʟɨռɢ ȶօ ֆɦǟʀɛ ֆօʍɛ օʄ ɦɛʀ ӄռօաʟɛɖɢɛ. 

ʏօʊ ʍǟʏ ǟֆӄ ɦɛʀ ǟ ֆɨռɢʟɛ զʊɛֆȶɨօռ ɮɛʄօʀɛ ֆɦɛ ʍʊֆȶ ʀɛֆȶ.",16,6,55,0,,
79,1536004144338591744,2022-06-12 15:15:00+00:00,False,ɛֆȶʀɛʟʟǟ ʝօɨռֆ ʏօʊʀ քǟʀȶʏ. https://t.co/4HAVgn4c97,21,10,66,1,{'media_keys': ['7_1536001082706612224']},"{'urls': [{'start': 27, 'end': 50, 'url': 'https://t.co/4HAVgn4c97', 'expanded_url': 'https://twitter.com/OccultTower/status/1536004144338591744/video/1', 'display_url': 'pic.twitter.com/4HAVgn4c97', 'media_key': '7_1536001082706612224'}]}"
80,1535822677088186371,2022-06-12 03:13:55+00:00,False,"ǟɖʋɛռȶʊʀɛʀֆ, աɨʟʟ ʏօʊ ƈɦօօֆɛ ӄɨռɖռɛֆֆ, օʀ ɮʀʊȶǟʟɨȶʏ?",13,10,41,0,{'poll_ids': ['1535822676672929793']},
81,1535822389098844161,2022-06-12 03:12:46+00:00,True,"ʜᴇʀ ꜰᴀᴄᴇ ᴡᴀꜱ ɢᴀᴜɴᴛ, ᴀɴᴅ ᴛᴇᴀʀꜱ ꜱᴛʀᴇᴀᴍᴇᴅ ᴅᴏᴡɴ ʜᴇʀ ᴄʜᴇᴇᴋꜱ. 

“ᴀʀᴇ ʏᴏᴜ ʀᴇᴀʟ?” ꜱʜᴇ ʙʀᴇᴀᴛʜᴇᴅ. 

ᴛʜᴇ ᴡᴀʀʀɪᴏʀ ᴡᴀꜱ Qᴜɪᴄᴋ ᴛᴏ ᴀᴘᴘʀᴏᴀᴄʜ ᴛʜᴇ ᴄᴇʟʟ, ᴇᴠᴇɴ ᴀᴛ ʜɪꜱ ᴄᴏᴍᴘᴀɴɪᴏɴꜱ’ ʜᴇꜱɪᴛᴀɴᴄᴇ.",4,1,33,0,,
82,1535822387987419137,2022-06-12 03:12:46+00:00,True,ᴛʜᴇ ᴀᴅᴠᴇɴᴛᴜʀᴇʀꜱ ᴡᴇʀᴇ ᴘʀᴇᴘᴀʀᴇᴅ ꜰᴏʀ ᴀɴᴏᴛʜᴇʀ ꜰɪɢʜᴛ—ʙᴜᴛ ᴡᴇʀᴇ ɪɴꜱᴛᴇᴀᴅ ɢʀᴇᴇᴛᴇᴅ ᴡɪᴛʜ ᴀ ᴄᴇʟʟ. ʟᴏᴄᴋᴇᴅ ɪɴꜱɪᴅᴇ ᴡᴀꜱ ᴀ ᴡᴏᴍᴀɴ ᴡᴇᴀʀɪɴɢ ᴛᴀᴛᴛᴇʀᴇᴅ ᴡʜɪᴛᴇ ʀᴏʙᴇꜱ.,4,1,30,0,,
83,1535822386892640257,2022-06-12 03:12:45+00:00,True,ᴛʜᴇ ᴄᴏʀʀɪᴅᴏʀ ᴡᴀꜱ ʜᴇᴡɴ ᴏꜰ ʀᴏᴜɢʜ ꜱᴛᴏɴᴇ ᴀɴᴅ ꜰᴏʟʟᴏᴡᴇᴅ ᴀ ᴍᴇᴀɴᴅᴇʀɪɴɢ ᴘᴀᴛʜ. ᴛʜᴇ ᴀᴅᴠᴇɴᴛᴜʀᴇʀꜱ ᴡᴇʀᴇ ᴄᴀᴜᴛɪᴏᴜꜱ ᴛᴏ ʟᴇᴛ ᴛʜᴇɪʀ ʟɪɢʜᴛꜱ ꜱᴛʀᴀʏ ᴛᴏᴏ ꜰᴀʀ ᴀʜᴇᴀᴅ ꜰᴏʀ ꜰᴇᴀʀ ᴏꜰ ᴅʀᴀᴡɪɴɢ ᴀᴛᴛᴇɴᴛɪᴏɴ.,1,1,14,0,,
84,1535822385705758722,2022-06-12 03:12:45+00:00,True,"ᴀ ꜱɪᴍᴘʟᴇ ɢᴇꜱᴛᴜʀᴇ ᴏᴠᴇʀ ʜɪꜱ ꜱʜᴏᴜʟᴅᴇʀ ꜱᴜᴍᴍᴏɴᴇᴅ ʜɪꜱ ᴍᴏꜱᴛ ʀᴇʟɪᴀʙʟᴇ ᴄᴏᴍᴘᴀᴛʀɪᴏᴛꜱ, ᴀɴᴅ ᴀꜰᴛᴇʀ ᴀ ꜱɪʟᴇɴᴛ ᴄᴏɴᴠᴇʀꜱᴀᴛɪᴏɴ, ᴛʜᴇʏ ʙᴇɢᴀɴ ꜱᴛᴀʟᴋɪɴɢ ᴅᴏᴡɴ ɪᴛꜱ ʟᴇɴɢᴛʜ.",1,1,13,0,,
85,1535822384384851969,2022-06-12 03:12:45+00:00,False,"ᴇᴄʜᴏᴇꜱ ᴏꜰ ʜᴇᴀᴠʏ ʙʀᴇᴀᴛʜɪɴɢ ᴀɴᴅ ᴇxʜᴀᴜꜱᴛᴇᴅ ᴍᴜʀᴍᴜʀꜱ ꜰɪʟʟᴇᴅ ᴛʜᴇ ᴄᴀᴠᴇʀɴᴏᴜꜱ ꜱᴘᴀᴄᴇ. 

ᴛʜᴇ ᴡᴀʀʀɪᴏʀ ꜱᴛᴏᴏᴅ ᴀᴘᴀʀᴛ ꜰʀᴏᴍ ᴛʜᴇᴍ ᴀʟʟ ᴀɴᴅ ꜱᴛᴀʀᴇᴅ ɪɴᴛᴏ ᴛʜᴇ ʟɪɢʜᴛʟᴇꜱꜱ ᴄᴏʀʀɪᴅᴏʀ.",13,2,53,0,,
86,1535714900454129667,2022-06-11 20:05:39+00:00,True,@OooEeeLL @Harryleemedia https://t.co/K01zEajrFd,0,0,3,0,{'media_keys': ['16_1535714894091366405']},"{'urls': [{'start': 25, 'end': 48, 'url': 'https://t.co/K01zEajrFd', 'expanded_url': 'https://twitter.com/OccultTower/status/1535714900454129667/photo/1', 'display_url': 'pic.twitter.com/K01zEajrFd', 'media_key': '16_1535714894091366405'}], 'mentions': [{'start': 0, 'end': 9, 'username': 'OooEeeLL', 'id': '1486504802695536641'}, {'start': 10, 'end': 24, 'username': 'Harryleemedia', 'id': '920469885787947013'}]}"
87,1535712983871016961,2022-06-11 19:58:02+00:00,False,"ǟɖʋɛռȶʊʀɛʀֆ, ʏօʊ ƈօʍɛ ȶօ ǟ ʟǟռɖɨռɢ օռ ȶɦɛ ֆքɨʀǟʟ ֆȶǟɨʀƈǟֆɛ. ǟ ɖɨʍʟʏ ʟɨȶ ɖǟʀӄ քǟֆֆǟɢɛ ʟɨռɛɖ աɨȶɦ ȶօʀƈɦɛֆ ʀɨɖɖʟɛɖ աɨȶɦ ƈօɮաɛɮֆ ʋɛɛʀֆ ȶօ ȶɦɛ ʟɛʄȶ. 

ʏօʊ ɦǟʋɛ ʄօʊʀ ɦօʊʀֆ ȶօ ɖɛƈɨɖɛ.",19,9,49,2,{'poll_ids': ['1535712983380369420']},
88,1535709018903261186,2022-06-11 19:42:16+00:00,False,"ǟɖʋɛռȶʊʀɛʀֆ, ȶɦɛ ȶɦʀɛɛ-ɦʊռɖʀɛɖ ȶɦɨʀȶʏ-ȶɦɨʀɖ ֆօʊʟ ɦǟֆ ʝօɨռɛɖ ȶɦɛ ɛȶɛʀռǟʟ ʄʟǟʍɛ. ʏօʊ ɦǟʋɛ ǟ ƈɦօɨƈɛ ȶօ ʍǟӄɛ. ɢǟȶɦɛʀ ȶօ ɖɨֆƈʊֆֆ, ǟֆ ǟ քօօʀ ƈɦօɨƈɛ աɨʟʟ ɮɛ ƈօֆȶʟʏ ...",19,6,66,1,,
89,1535657108561092608,2022-06-11 16:16:00+00:00,False,"ǟɖʋɛռȶʊʀɛʀֆ, աɛ ǟʀɛ ռɛǟʀɨռɢ ɦǟʟʄ ɦɨֆ ʍǟʀӄ, օռƈɛ ȶɦɛʀɛ ʏօʊ ʍǟʏ քʀօƈɛɛɖ.",16,3,65,0,,
90,1535649758924120065,2022-06-11 15:46:48+00:00,False,"ȶɦɛ ǟɖʋɛռȶʊʀɛʀֆ ɦǟʋɛ ƈǟʟʟɛɖ ǟ ʍɛɛȶɨռɢ.

 https://t.co/P4s8bgFi9b",10,1,28,0,,"{'urls': [{'start': 41, 'end': 64, 'url': 'https://t.co/P4s8bgFi9b', 'expanded_url': 'https://twitter.com/i/spaces/1vAxRkBeZRqKl', 'display_url': 'twitter.com/i/spaces/1vAxR…', 'images': [{'url': 'https://pbs.twimg.com/news_img/1535633305395154945/Oum9o-o-?format=jpg&name=orig', 'width': 1200, 'height': 630}, {'url': 'https://pbs.twimg.com/news_img/1535633305395154945/Oum9o-o-?format=jpg&name=150x150', 'width': 150, 'height': 150}], 'status': 200, 'title': 'Scheduled: Tower of the Occult NFT AMA', 'description': 'IceMan’s space · Where live audio conversations happen', 'unwound_url': 'https://twitter.com/i/spaces/1vAxRkBeZRqKl'}]}"
91,1535643523634016258,2022-06-11 15:22:01+00:00,False,"ǟɖʋɛռȶʊʀɛʀֆ, ֆօօռ ʏօʊ աɨʟʟ ʄǟƈɛ ǟ ƈɦօɨƈɛ. ɖօ ռօȶ ʀʊֆɦ, ʄօʀ ɨȶ աɨʟʟ ʄօʀɛʋɛʀ ǟʟȶɛʀ ȶɦɛ ƈօʊʀֆɛ օʄ ȶɦɨֆ ʝօʊʀռɛʏ.",22,9,73,1,,
92,1535639906881519625,2022-06-11 15:07:39+00:00,False,"ǟɖʋɛռȶʊʀɛʀֆ, ȶɦɛ ȶɦʀɛֆɦօʟɖ ɨֆ ռɛǟʀ. ʏօʊʀ ֆǟƈʀɨʄɨƈɛֆ ǟʀɛ ʍǟռʏ. ֆօօռ ȶɦɛ ռɛӼȶ ƈɦǟքȶɛʀ ɮɛɢɨռֆ.",17,8,60,0,,
93,1535407666004213760,2022-06-10 23:44:48+00:00,False,"RT @NickJobe6: @OccultTower are fanning the flames, are you ready to sacrifice and send what you love to burn? https://t.co/wjd1nsNYpy",12,0,0,0,{'media_keys': ['7_1535406209263616000']},"{'urls': [{'start': 111, 'end': 134, 'url': 'https://t.co/wjd1nsNYpy', 'expanded_url': 'https://twitter.com/NickJobe6/status/1535406768251084800/video/1', 'display_url': 'pic.twitter.com/wjd1nsNYpy', 'media_key': '7_1535406209263616000'}], 'mentions': [{'start': 3, 'end': 13, 'username': 'NickJobe6', 'id': '1246323863593594880'}, {'start': 15, 'end': 27, 'username': 'OccultTower', 'id': '1533184058112454657'}]}"
94,1535396159551852544,2022-06-10 22:59:05+00:00,False,ȶɦɛʀɛ ɨֆ ǟʟաǟʏֆ ɖɛǟȶɦ ɨռ ʟɨʄɛ.,24,15,73,1,,
95,1535380132486991872,2022-06-10 21:55:24+00:00,False,ǟ աօʀȶɦʏ ֆǟƈʀɨʄɨƈɛ. https://t.co/cdo0NRuCT5,10,3,46,0,,"{'urls': [{'start': 20, 'end': 43, 'url': 'https://t.co/cdo0NRuCT5', 'expanded_url': 'https://twitter.com/BravoZuloo/status/1535379344029147136', 'display_url': 'twitter.com/BravoZuloo/sta…'}]}"
96,1535378210766004224,2022-06-10 21:47:46+00:00,False,"RT @StrawHatmac: @OccultTower ɨ ɖօ ռօȶ ɦǟʋɛ ʍǟռʏ ֆօʊʟֆ.... ɮʊȶ ʄօʀȶʊռɛ ʄǟʋօʀֆ ȶɦɛ ɮօʟɖ. ǟռօȶɦɛʀ ֆǟƈʀɨʄɨƈɛ ʄօʀ ȶɦɛ ɢʀɛǟȶɛʀ ɢօօɖ

https://t.c…",6,0,0,0,,"{'mentions': [{'start': 3, 'end': 15, 'username': 'StrawHatmac', 'id': '1477064299042455564'}, {'start': 17, 'end': 29, 'username': 'OccultTower', 'id': '1533184058112454657'}]}"
97,1535372966837424128,2022-06-10 21:26:55+00:00,True,"@AdgeGat ֆɦօʊʟɖɛʀ ȶօ ֆɦօʊʟɖɛʀ.

https://t.co/Xsq7Nblpcw",1,1,8,0,,"{'urls': [{'start': 32, 'end': 55, 'url': 'https://t.co/Xsq7Nblpcw', 'expanded_url': 'https://etherscan.io/tx/0x43050e9970cc706a7d0d32f75ca9a239b435db2668475e2473035b8609d41cef', 'display_url': 'etherscan.io/tx/0x43050e997…'}], 'mentions': [{'start': 0, 'end': 8, 'username': 'AdgeGat', 'id': '1196277534804996096'}]}"
98,1535371265413890055,2022-06-10 21:20:10+00:00,True,@0xMoist ɛǟƈɦ ǟɖʋɛռȶʊʀɛʀ ռɛɛɖ օռʟʏ ֆǟƈʀɨʄɨƈɛ օռɛ. ʍʊʟȶɨքʟɛֆ աɨʟʟ ɮɛ ʟօօӄɛɖ ʊքօռ ʄǟʋօʀǟɮʟʏ.,4,0,11,0,,"{'mentions': [{'start': 0, 'end': 8, 'username': '0xMoist', 'id': '1133785739169165312'}]}"
99,1535369396994338821,2022-06-10 21:12:44+00:00,True,https://t.co/dS43LSgLn1,14,1,47,0,{'media_keys': ['3_1535369390522257409']},"{'urls': [{'start': 0, 'end': 23, 'url': 'https://t.co/dS43LSgLn1', 'expanded_url': 'https://twitter.com/OccultTower/status/1535369396994338821/photo/1', 'display_url': 'pic.twitter.com/dS43LSgLn1', 'media_key': '3_1535369390522257409'}]}"
100,1535368917690236929,2022-06-10 21:10:50+00:00,False,"ƈօռɢʀǟȶʊʟǟȶɨօռֆ ǟɖʋɛռȶʊʀɛʀֆ, ʏօʊ ɦǟʋɛ ʍǟɖɛ ɨȶ ȶօ ȶɦɛ ֆȶǟʀȶ օʄ ȶɦɛ 3ʀɖ ʄʟօօʀ. 

ȶɦɛ ɛȶɛʀռǟʟ ʄʟǟʍɛ ʀɛզʊɨʀɛֆ ʄʊʀȶɦɛʀ ֆǟƈʀɨʄɨƈɛ քʀɨօʀ ȶօ ȶɦɛ ȶօք ʄʟօօʀ. ʏօʊ ɦǟʋɛ ʍǟɖɛ ɢʀɛǟȶ ֆȶʀɨɖɛֆ.",17,21,62,1,,
101,1535364298532392963,2022-06-10 20:52:29+00:00,False,ɖɛքǟʀȶʊʀɛ. - https://t.co/v7nFVCHO3j,22,7,43,1,,"{'urls': [{'start': 13, 'end': 36, 'url': 'https://t.co/v7nFVCHO3j', 'expanded_url': 'https://twitter.com/i/spaces/1OyKADYaBZexb', 'display_url': 'twitter.com/i/spaces/1OyKA…'}]}"
102,1535362945357586432,2022-06-10 20:47:06+00:00,False,ʄɨʋɛ ʍɨռʊȶɛֆ.,21,22,59,0,,
103,1535360896268050432,2022-06-10 20:38:57+00:00,False,"RT @OccultTower: @0xMoist @syne_eth ɨռ ʟɨʄɛ, ȶɦɛ ɮօʟɖ օʄȶɛռ ʀɛǟք ȶɦɛ ʀɛաǟʀɖֆ.

ȶɦɛ ȶօք օʄ ȶɦɛ ȶɦɛ ȶօաɛʀ ɨֆ ռɛǟʀ. ֆօօռ ȶɦɛ ֆǟƈʀɨʄɨƈɨǟʟ աɨռɖօ…",16,0,0,0,,"{'mentions': [{'start': 3, 'end': 15, 'username': 'OccultTower', 'id': '1533184058112454657'}, {'start': 17, 'end': 25, 'username': '0xMoist', 'id': '1133785739169165312'}, {'start': 26, 'end': 35, 'username': 'syne_eth', 'id': '1480582924533743620'}]}"
104,1535359731916623872,2022-06-10 20:34:20+00:00,False,"RT @0xMoist: @syne_eth @OccultTower Could be nothing, could be big.",4,0,0,0,,"{'mentions': [{'start': 3, 'end': 11, 'username': '0xMoist', 'id': '1133785739169165312'}, {'start': 13, 'end': 22, 'username': 'syne_eth', 'id': '1480582924533743620'}, {'start': 23, 'end': 35, 'username': 'OccultTower', 'id': '1533184058112454657'}]}"
105,1535359698093780992,2022-06-10 20:34:12+00:00,True,"@0xMoist @syne_eth ɨռ ʟɨʄɛ, ȶɦɛ ɮօʟɖ օʄȶɛռ ʀɛǟք ȶɦɛ ʀɛաǟʀɖֆ.

ȶɦɛ ȶօք օʄ ȶɦɛ ȶɦɛ ȶօաɛʀ ɨֆ ռɛǟʀ. ֆօօռ ȶɦɛ ֆǟƈʀɨʄɨƈɨǟʟ աɨռɖօա աɨʟʟ ƈʟօֆɛ.",16,3,38,1,,"{'mentions': [{'start': 0, 'end': 8, 'username': '0xMoist', 'id': '1133785739169165312'}, {'start': 9, 'end': 18, 'username': 'syne_eth', 'id': '1480582924533743620'}]}"
106,1535358605448187904,2022-06-10 20:29:51+00:00,True,"@IceManCRYPTOS ɛӼƈɛքȶɨօռǟʟ ƈօռȶʀɨɮʊȶɨօռֆ ǟʀɛ ռօȶɛɖ. ȶɦǟռӄ ʏօʊ, ǟɖʋɛռȶʊʀɛʀ.",1,1,6,0,,"{'mentions': [{'start': 0, 'end': 14, 'username': 'IceManCRYPTOS', 'id': '1461762401691394049'}]}"
107,1535358251604201472,2022-06-10 20:28:27+00:00,False,RT @IceManCRYPTOS: @OccultTower #AscendTheTower Oh great Occult-Summoner my new Adventures that you have awarded me with will serve me well…,8,0,0,0,,"{'hashtags': [{'start': 32, 'end': 47, 'tag': 'AscendTheTower'}], 'mentions': [{'start': 3, 'end': 17, 'username': 'IceManCRYPTOS', 'id': '1461762401691394049'}, {'start': 19, 'end': 31, 'username': 'OccultTower', 'id': '1533184058112454657'}]}"
108,1535356734876725248,2022-06-10 20:22:25+00:00,False,"RT @0xMoist: 241 @OccultTower NFTs have been burned.

Price hit a lot of 0.011ETH and is now 0.036ETH.

Still not sure what's going on but…",7,0,0,0,,"{'mentions': [{'start': 3, 'end': 11, 'username': '0xMoist', 'id': '1133785739169165312'}, {'start': 17, 'end': 29, 'username': 'OccultTower', 'id': '1533184058112454657'}]}"
109,1535347299357847553,2022-06-10 19:44:56+00:00,True,@IceManCRYPTOS ʀɛɨռʄօʀƈɛʍɛռȶֆ աɨʟʟ ֆօօռ ǟʀʀɨʋɛ.,3,4,9,0,,"{'mentions': [{'start': 0, 'end': 14, 'username': 'IceManCRYPTOS', 'id': '1461762401691394049'}]}"
110,1535344947901083649,2022-06-10 19:35:35+00:00,False,"ȶɦǟռӄ ʏօʊ ʄօʀ ʏօʊʀ ƈօռȶʀɨɮʊȶɨօռ, ǟɖʋɛռȶʊʀɛʀ. 

քօֆȶ ʏօʊʀ ǟɖɖʀɛֆֆ ֆօ աɛ ʍǟʏ ɢʀօա ʏօʊʀ ʀǟռӄֆ. https://t.co/6350EYSAGn",13,31,36,0,,"{'urls': [{'start': 92, 'end': 115, 'url': 'https://t.co/6350EYSAGn', 'expanded_url': 'https://twitter.com/IceManCRYPTOS/status/1535338754109497348', 'display_url': 'twitter.com/IceManCRYPTOS/…'}]}"
111,1535340546100563968,2022-06-10 19:18:06+00:00,False,RT @IceManCRYPTOS: @OccultTower #AscendTheTower THESE NFT's are PUMPING! https://t.co/SCnbVLh8Mm,20,0,0,0,,"{'hashtags': [{'start': 32, 'end': 47, 'tag': 'AscendTheTower'}], 'urls': [{'start': 73, 'end': 96, 'url': 'https://t.co/SCnbVLh8Mm', 'expanded_url': 'https://youtu.be/kmXzQiGE8Zc', 'display_url': 'youtu.be/kmXzQiGE8Zc'}], 'mentions': [{'start': 3, 'end': 17, 'username': 'IceManCRYPTOS', 'id': '1461762401691394049'}, {'start': 19, 'end': 31, 'username': 'OccultTower', 'id': '1533184058112454657'}]}"
112,1535330080007720960,2022-06-10 18:36:30+00:00,False,"RT @HerbNinjah: @OccultTower verified on looksrare!! 👀 #AscendTheTower 
Come join the community led discord https://t.co/F86Ou3euVQ https:/…",19,0,0,0,,"{'hashtags': [{'start': 55, 'end': 70, 'tag': 'AscendTheTower'}], 'urls': [{'start': 108, 'end': 131, 'url': 'https://t.co/F86Ou3euVQ', 'expanded_url': 'https://discord.gg/ujpzzhJ7', 'display_url': 'discord.gg/ujpzzhJ7'}], 'mentions': [{'start': 3, 'end': 14, 'username': 'HerbNinjah', 'id': '1495058393509285892'}, {'start': 16, 'end': 28, 'username': 'OccultTower', 'id': '1533184058112454657'}]}"
113,1535304062475726850,2022-06-10 16:53:07+00:00,False,"RT @HerbNinjah: ȶɦɛ ǟɖʋɛռȶʊʀɛʀֆ ɦǟʋɛ ʊռɨȶɛɖ, ȶօɢɛȶɦɛʀ ȶɦɛʏ ֆȶǟռɖ ֆȶʀօռɢ ǟռɖ ǟʀɛ ֆɦօաɨռɢ ȶɦɛɨʀ ʄǟɨȶɦ. ʝօɨռ օʊʀ ʀǟռӄֆ ɨռ օʊʀ ƈօʍʍʊռɨȶʏ ƈǟʍք h…",14,0,0,0,,"{'mentions': [{'start': 3, 'end': 14, 'username': 'HerbNinjah', 'id': '1495058393509285892'}]}"
114,1535281471337930752,2022-06-10 15:23:21+00:00,False,ɖօɛֆ ֆɨʟǟֆ ʟɛǟɖ ȶɦɛ ǟɖʋɛռȶʊʀɛʀֆ օʊȶ օʄ ȶɦɛ ʟɨɮʀǟʀʏ ȶօɖǟʏ?,15,11,35,1,{'poll_ids': ['1535281470931099649']},
115,1535246077875654658,2022-06-10 13:02:43+00:00,False,ȶաօ ɦʊռɖʀɛɖ ֆօʊʟֆ ɦǟʋɛ ʝօɨռɛɖ ȶɦɛ ɛȶɛʀռǟʟ ʄʟǟʍɛ. https://t.co/n54V59Cfpe,26,10,76,1,{'media_keys': ['16_1535246071261167616']},"{'urls': [{'start': 49, 'end': 72, 'url': 'https://t.co/n54V59Cfpe', 'expanded_url': 'https://twitter.com/OccultTower/status/1535246077875654658/photo/1', 'display_url': 'pic.twitter.com/n54V59Cfpe', 'media_key': '16_1535246071261167616'}]}"
116,1535230463865913344,2022-06-10 12:00:40+00:00,True,@GmeWizard ȶɦɛ ȶʀʊʟʏ ǟɖʋɛռȶʊʀօʊֆ ǟʟաǟʏֆ ʄɨռɖ ǟ ɦɨɖɖɛռ ɢɛʍ.,2,1,6,0,,"{'mentions': [{'start': 0, 'end': 10, 'username': 'GmeWizard', 'id': '1382252851741786113'}]}"
117,1535230144238985216,2022-06-10 11:59:24+00:00,True,@0xMoist @syne_eth ȶɦɛʀɛ ɨֆ ǟʟաǟʏֆ ɖɛǟȶɦ ɨռ ʟɨʄɛ.,1,1,3,0,,"{'mentions': [{'start': 0, 'end': 8, 'username': '0xMoist', 'id': '1133785739169165312'}, {'start': 9, 'end': 18, 'username': 'syne_eth', 'id': '1480582924533743620'}]}"
