,id,date,this_is_reply,text,retweets,replies,likes,quotes,attachments,entities
0,1539080119041544192,2022-06-21 02:57:49+00:00,False,RT @KushKongz11: Just Burned 37 to you @OccultTower - faithless is he that says farewell when the road darkens @CullenColors https://t.co/4…,11,0,0,0,,"{'mentions': [{'start': 3, 'end': 15, 'username': 'KushKongz11', 'id': '1413533978645057536'}, {'start': 39, 'end': 51, 'username': 'OccultTower', 'id': '1533184058112454657'}, {'start': 111, 'end': 124, 'username': 'CullenColors', 'id': '1055814370582818816'}]}"
1,1539050281861718017,2022-06-21 00:59:16+00:00,False,RT @OccultTowerTeam: Come discuss our token in a community AMA. We will address any commonly asked questions when the space ended.,9,0,0,0,,"{'mentions': [{'start': 3, 'end': 19, 'username': 'OccultTowerTeam', 'id': '1536727727541170176'}]}"
2,1539046484376662017,2022-06-21 00:44:10+00:00,False,"ǟɖʋɛռȶʊʀɛʀֆ, օʋɛʀ ֆɛʋɛռ-ɦʊռɖʀɛɖ ֆɛʋɛռȶʏ-ֆɛʋɛռ օƈƈʊʟȶ, օʀ ʍօʀɛ ȶɦǟռ ȶɛռ քɛʀƈɛռȶ օʄ օʊʀ ʀǟռӄֆ, ɦǟʋɛ ʝօɨռɛɖ ȶɦɛ ɛȶɛʀռǟʟ ʄʟǟʍɛ.

ʍǟռʏ ǟʀɛ ֆʟɛɛքɨռɢ օռ օʊʀ ʝօʊʀռɛʏ. ֆօօռ ȶɦɛʏ աɨʟʟ աǟӄɛ. ȶɦɨֆ ɨֆ ֆȶɨʟʟ ɮʊȶ ȶɦɛ ɮɛɢɨռռɨռɢ.",16,2,43,0,,
3,1539028389188624384,2022-06-20 23:32:16+00:00,False,"RT @FogoNFT: Well, dont see innovation in NFTs very often anymore. Especially not on a free mint.

@OccultTower put out their $CINDER token…",17,0,0,0,,"{'cashtags': [{'start': 126, 'end': 133, 'tag': 'CINDER'}], 'annotations': [{'start': 42, 'end': 45, 'probability': 0.3796, 'type': 'Place', 'normalized_text': 'NFTs'}], 'mentions': [{'start': 3, 'end': 11, 'username': 'FogoNFT', 'id': '1414975073069375492'}, {'start': 99, 'end': 111, 'username': 'OccultTower', 'id': '1533184058112454657'}]}"
4,1539023044311584768,2022-06-20 23:11:02+00:00,False,RT @LaPittera: So after i bought into @OccultTower i thought it is a degen move. Got really quite there. Then the storyline and awesome med…,13,0,0,0,,"{'mentions': [{'start': 3, 'end': 13, 'username': 'LaPittera', 'id': '1530851182545092609'}, {'start': 38, 'end': 50, 'username': 'OccultTower', 'id': '1533184058112454657'}]}"
5,1539021782643945473,2022-06-20 23:06:01+00:00,False,"RT @OccultTowerTeam: As far as we know, we are the first ever #Burn2Earn project.

Spread the word and lets keep innovating....",20,0,0,0,,"{'mentions': [{'start': 3, 'end': 19, 'username': 'OccultTowerTeam', 'id': '1536727727541170176'}], 'hashtags': [{'start': 62, 'end': 72, 'tag': 'Burn2Earn'}]}"
6,1539009304107159553,2022-06-20 22:16:26+00:00,False,RT @OccultTowerTeam: Here are the tokenomics in a cleaner font. Feel free to place your questions below. AMA. https://t.co/7dTvTBPRS2,15,0,0,0,{'media_keys': ['3_1539009204484116480']},"{'urls': [{'start': 110, 'end': 133, 'url': 'https://t.co/7dTvTBPRS2', 'expanded_url': 'https://twitter.com/OccultTowerTeam/status/1539009235857526785/photo/1', 'display_url': 'pic.twitter.com/7dTvTBPRS2', 'media_key': '3_1539009204484116480'}], 'mentions': [{'start': 3, 'end': 19, 'username': 'OccultTowerTeam', 'id': '1536727727541170176'}]}"
7,1539008759820853249,2022-06-20 22:14:16+00:00,False,"RT @OccultTower: ƈօռɢʀǟȶʊʟǟȶɨօռֆ, ǟɖʋɛռȶʊʀɛʀֆ. քǟȶɨɛռƈɛ աɨʟʟ ɮɛ ʀɛաǟʀɖɛɖ. https://t.co/CNeQ84DQXa",19,0,0,0,{'media_keys': ['3_1539008307674816513']},"{'urls': [{'start': 74, 'end': 97, 'url': 'https://t.co/CNeQ84DQXa', 'expanded_url': 'https://twitter.com/OccultTower/status/1539008320354193408/photo/1', 'display_url': 'pic.twitter.com/CNeQ84DQXa', 'media_key': '3_1539008307674816513'}], 'mentions': [{'start': 3, 'end': 15, 'username': 'OccultTower', 'id': '1533184058112454657'}]}"
8,1539008320354193408,2022-06-20 22:12:31+00:00,False,"ƈօռɢʀǟȶʊʟǟȶɨօռֆ, ǟɖʋɛռȶʊʀɛʀֆ. քǟȶɨɛռƈɛ աɨʟʟ ɮɛ ʀɛաǟʀɖɛɖ. https://t.co/CNeQ84DQXa",19,5,48,0,{'media_keys': ['3_1539008307674816513']},"{'urls': [{'start': 57, 'end': 80, 'url': 'https://t.co/CNeQ84DQXa', 'expanded_url': 'https://twitter.com/OccultTower/status/1539008320354193408/photo/1', 'display_url': 'pic.twitter.com/CNeQ84DQXa', 'media_key': '3_1539008307674816513'}]}"
9,1539007886881193984,2022-06-20 22:10:48+00:00,True,"աɨȶɦ ռօ ɦɛֆɨȶǟȶɨօռ, ȶɦɛ ʊռռǟʍɛɖ աǟʀʀɨօʀ քʀɨɛɖ օքɛռ ȶɦɛ ƈɦɛֆȶ. 

ȶօ ɦɨֆ ֆʊʀքʀɨֆɛ, ȶɦɛʀɛ աɛʀɛ ռօ ȶʀɛǟֆʊʀɛֆ ɦɨɖɖɛռ աɨȶɦɨռ, ɮʊȶ ɨռֆȶɛǟɖ ǟ ֆɨռɢʟɛ ɖʊֆȶʏ ǟռɖ ȶօʀռ ֆƈʀօʟʟ. 

ȶɦɛ աǟʀʀɨօʀ ֆȶʊɖɨɛɖ ȶɦɛ ֆƈʀօʟʟ, ɮʊȶ աɨȶɦօʊȶ աǟʀռɨռɢ ɨȶ ƈօʍɮʊֆȶɛɖ ɨռȶօ ǟ քɨʟɛ օʄ ƈɨռɖɛʀֆ օռ ȶɦɛ ʄʟօօʀ.",4,1,28,0,,
10,1539007885543280640,2022-06-20 22:10:47+00:00,False,"ȶɦɛ ǟɖʋɛռȶʊʀɛʀֆ ǟքʀʀօǟƈɦɛɖ ȶɦɛ օʀռǟȶɛ ɖօօʀ. ȶɦɛ ʍɛȶǟʟ ɢʀօǟռɛɖ ʊքօռ օքɛռɨռɢ, ǟֆ ƈʟɛǟʀʟʏ ȶɦɛ ɖօօʀ ɦǟɖ ʀɛʍǟɨռɛɖ ƈʟօֆɛɖ ʄօʀ ֆօʍɛ ȶɨʍɛ.

ȶɦɛ ʀօօʍ ʀɛʋɛǟʟɛɖ ɮɛɦɨռɖ ȶɦɛ ɖօօʀ աǟֆ ֆʊʀքʀɨֆɨռɢʟʏ ֆʍǟʟʟ. ɨռֆɨɖɛ, ǟ ֆɨռɢʟɛ ʝɛաɛʟɛɖ ƈɦɛֆȶ, ǟֆ օʀռǟȶɛ ǟֆ ȶɦɛ ɖօօʀ ƈօռƈɛǟʟɨռɢ ɨȶ, ֆǟȶ օռ ȶɦɛ ʄʟօօʀ.",7,1,32,0,,
11,1539004272783794176,2022-06-20 21:56:26+00:00,False,"ƈօռɢʀǟȶʊʟǟȶɨօռֆ ǟɖʋɛռȶʊʀɛʀֆ. աɛ ɦօքɛ ʏօʊ’ʀɛ ʟɛǟʀռɨռɢ ǟռɖ ɛռʝօʏɨռɢ ȶɦɨֆ քʀօʝɛƈȶ ǟֆ ʍʊƈɦ ǟֆ աɛ ǟʀɛ. ʄօʀ ɦɨȶȶɨռɢ ȶɦɛ ʍǟʀӄ օʄ ȶɦɛ ɮɛǟֆȶ ɮɛʄօʀɛ ȶɦɛ ֆռǟք ֆɦօȶ, աɛ աɨʟʟ ʀɛʟɛǟֆɛ ȶɦɛ ȶօӄɛռօʍɨƈֆ ֆƈʀօʟʟ ֆօօռ.",16,2,50,0,,
12,1538952517526204417,2022-06-20 18:30:47+00:00,False,RT @OccultTowerTeam: Quick banner sneak https://t.co/P3sKtTDYXp,26,0,0,0,{'media_keys': ['3_1538952354506194944']},"{'urls': [{'start': 40, 'end': 63, 'url': 'https://t.co/P3sKtTDYXp', 'expanded_url': 'https://twitter.com/OccultTowerTeam/status/1538952440317362178/photo/1', 'display_url': 'pic.twitter.com/P3sKtTDYXp', 'media_key': '3_1538952354506194944'}], 'mentions': [{'start': 3, 'end': 19, 'username': 'OccultTowerTeam', 'id': '1536727727541170176'}]}"
13,1538345257384849411,2022-06-19 02:17:45+00:00,False,"ǟɖʋɛռȶʊʀɛʀֆ, ȶɦɛ ǟֆƈɛռȶ ɨֆ ʍօʀɛ ɛռʝօʏǟɮʟɛ ȶօɢɛȶɦɛʀ.

ʝօɨռ ȶɦɛ ɖɨֆƈʊֆֆɨօռ ɨռ օʊʀ ƈօʍʍʊռɨȶʏ ʀʊռ ɖɨֆƈօʀɖ: https://t.co/lVUv6awi8L",18,6,42,1,,"{'urls': [{'start': 103, 'end': 126, 'url': 'https://t.co/lVUv6awi8L', 'expanded_url': 'https://discord.gg/BRN5pmsA5y', 'display_url': 'discord.gg/BRN5pmsA5y'}]}"
14,1538317947533307904,2022-06-19 00:29:13+00:00,False,"ʏօʊ ɦǟʋɛ ƈɦօֆɛռ ȶɦɛ աօօɖɛռ ɖօօʀ ƈօʋɛʀɛɖ ɨռ ʀօȶ.

ɮɛʄօʀɛ աɛ քʀօƈɛɛɖ, ɨ ɦǟʋɛ ǟ քʀօքօֆǟʟ…

ɨ ƈǟռ ʀɛʋɛǟʟ աɦǟȶ ʟɨɛֆ ɮɛɦɨռɖ ȶɦɛ օʀռǟȶɛ ʍɛȶǟʟ ɖօօʀ, ɮʊȶ ɨȶ’ֆ ƈօռȶɛռȶֆ աɨʟʟ ʀɛʍǟɨռ օʊȶֆɨɖɛ ʏօʊʀ ɢʀǟֆք.

քɛʀɦǟքֆ ֆօʍɛ ȶɦɨռɢֆ ǟʀɛ ɮɛȶȶɛʀ ʟɛʄȶ ʊռӄռօառ?

օɦ, ǟռɖ ȶɦɛʀɛ աɨʟʟ ɮɛ ǟ քʀɨƈɛ ȶօ քǟʏ..",8,11,32,0,{'poll_ids': ['1538317947197804544']},
15,1538285982075629568,2022-06-18 22:22:12+00:00,False,"RT @NFTfolioApp: ✨ Today we're excited to welcome @OccultTower as a featured project now supported on the first-ever NFT tracker app 🚀 

Al…",17,0,0,0,,"{'mentions': [{'start': 3, 'end': 15, 'username': 'NFTfolioApp', 'id': '1501715071944249344'}, {'start': 50, 'end': 62, 'username': 'OccultTower', 'id': '1533184058112454657'}]}"
16,1538264028060930049,2022-06-18 20:54:58+00:00,False,"RT @OccultTowerTeam: You can consider the current Occult NFTs our genesis collection. 

The cornerstone of our world now and going forward.",23,0,0,0,,"{'mentions': [{'start': 3, 'end': 19, 'username': 'OccultTowerTeam', 'id': '1536727727541170176'}]}"
17,1538262625296842752,2022-06-18 20:49:24+00:00,False,"RT @OccultTowerTeam: If you have sacrificed all your Occult, you will still receive the reward from the snapshot, but you will need at leas…",22,0,0,0,,"{'mentions': [{'start': 3, 'end': 19, 'username': 'OccultTowerTeam', 'id': '1536727727541170176'}]}"
18,1538204315067641858,2022-06-18 16:57:41+00:00,False,"ȶɦɛ ǟɖʋɛռȶʊʀɛʀֆ քɛɛʀ ȶɦʀօʊɢɦ ȶɦɛ ɮǟʀֆ օʄ ȶɦɛ ɢʟօաɨռɢ ƈɛʟʟ ɖօօʀ.. ȶɦɛ ֆӄɛʟɛȶօռ օʄ ǟ ʟօռɢ ɖɛǟɖ ǟɖʋɛռȶʊʀɛʀ ʟǟʏֆ ֆȶʀɛառ ǟƈʀօֆֆ ȶɦɛ ʄʟօօʀ.

ǟ աɨƈӄʟɛֆֆ ƈǟռɖʟɛ, ֆɛɛʍɨռɢʟʏ ɛռƈɦǟռȶɛɖ ȶօ ɮʊʀռ ʄօʀɛʋɛʀ ֆɨȶֆ ǟȶ ɨȶֆ ʄɛɛȶ.

ǟʋօɨɖɨռɢ ȶɦɨֆ ɖօօʀ աǟֆ ǟ աɨֆɛ ƈɦօɨƈɛ, ǟɖʋɛռȶʊʀɛʀֆ.",14,6,49,0,,
19,1538201767111929857,2022-06-18 16:47:34+00:00,False,RT @OccultTowerTeam: Who’s ready? 👀 https://t.co/mQc4PAw851,32,0,0,0,{'media_keys': ['16_1538201666058526720']},"{'urls': [{'start': 36, 'end': 59, 'url': 'https://t.co/mQc4PAw851', 'expanded_url': 'https://twitter.com/OccultTowerTeam/status/1538201696454660096/photo/1', 'display_url': 'pic.twitter.com/mQc4PAw851', 'media_key': '16_1538201666058526720'}], 'mentions': [{'start': 3, 'end': 19, 'username': 'OccultTowerTeam', 'id': '1536727727541170176'}]}"
20,1538163909865066497,2022-06-18 14:17:08+00:00,False,RT @IceManCRYPTOS: 608 NFT’s Burned! 🔥  This Community is so Bulish on #TOTO @OccultTower  https://t.co/2fZVW2IfXL,16,0,0,0,,"{'urls': [{'start': 91, 'end': 114, 'url': 'https://t.co/2fZVW2IfXL', 'expanded_url': 'https://youtu.be/8eQVVSUAkBk', 'display_url': 'youtu.be/8eQVVSUAkBk'}], 'mentions': [{'start': 3, 'end': 17, 'username': 'IceManCRYPTOS', 'id': '1461762401691394049'}, {'start': 77, 'end': 89, 'username': 'OccultTower', 'id': '1533184058112454657'}], 'hashtags': [{'start': 71, 'end': 76, 'tag': 'TOTO'}]}"
21,1537988826542460928,2022-06-18 02:41:25+00:00,False,"ǟɖʋɛռȶʊʀɛʀֆ, ʀɛʍɛʍɮɛʀ ȶօ ƈօռֆɨɖɛʀ ȶɦɛ ƈʟʊɛ ʄʀօʍ ȶɦɛ ʟɨɮʀǟʀʏ աɦɛռ ʍǟӄɨռɢ ʏօʊʀ ɖɛƈɨֆɨօռ.

օɦ, ʏօʊ ɖɨɖռ’ȶ ʄɨռɖ ɨȶ?

ɢօօɖ ʟʊƈӄ…",7,7,39,0,,
22,1537985592167845888,2022-06-18 02:28:34+00:00,False,"ռօա, ʏօʊ ʍʊֆȶ ƈɦօօֆɛ… ʏօʊ ɦǟʋɛ ʊռȶɨʟ ɖǟառ…",8,4,28,0,{'poll_ids': ['1537985591823826946']},
23,1537984975068225539,2022-06-18 02:26:07+00:00,False,"ȶɦɛ ɖօօʀs…

ȶɦɛ ʄɨʀֆȶ, ǟռ օʟɖ աօօɖɛռ ɖօօʀ ֆǟɢɢɨռɢ օռ ɨȶֆ ɦɨռɢɛֆ, ɖɨֆƈօʟօʀɛɖ աɨȶɦ ʀօȶ.

ȶɦɛ ռɛӼȶ, ǟ ʍɛȶǟʟ ɖօօʀ,  ƈօʋɛʀɛɖ ɨռ ʀɨʋɛȶֆ, ɛʍɮɛʟʟɨֆɦɛɖ աɨȶɦ ǟռ օʀռǟȶɛ քǟȶȶɛʀռ.

ȶɦɛ ʟǟֆȶ, ǟ ֆʍǟʟʟ աɨռɖօա աɨȶɦ ɨʀօռ ɮǟʀֆ ɨȶֆ օռʟʏ ʀɛʍǟʀӄǟɮʟɛ ʄɛǟȶʊʀɛ. ǟ ʄǟɨռȶ օʀǟռɢɛ ɢʟօա ɛʍǟռǟȶɛֆ ʄʀօʍ ɨռֆɨɖɛ.",6,0,32,0,,
24,1537971585990074376,2022-06-18 01:32:54+00:00,False,"աɨȶɦ ɛֆȶʀɛʟʟǟ’ֆ ɦɛʟք, ȶɦɛ ʍɨʍɨƈֆ ɦǟʋɛ ɮɛɛռ ɖɨֆքɛʟʟɛɖ ǟռɖ ȶɦɛ ʀɛʍǟɨռɨռɢ ǟɖʋɛռȶʊʀɛʀֆ ʄɨռɖ ȶɦɛʍֆɛʟʋɛֆ ɨռ ǟ ʟǟʀɢɛ օքɛռ ֆքǟƈɛ.

ǟʄȶɛʀ ֆօʍɛ ɛӼքʟօʀǟȶɨօռ, ǟ քǟֆֆǟɢɛ ɨֆ ʄօʊռɖ, ǟȶ ȶɦɛ ɛռɖ ֆɨȶ ȶɦʀɛɛ ɖօօʀֆ. 

ֆօօռ ʏօʊ ʍʊֆȶ ƈɦօօֆɛ.",13,0,47,0,,
25,1537967122873102339,2022-06-18 01:15:10+00:00,False,"ʍɨʍɨƈֆ ǟʀɛ ɖǟռɢɛʀօʊֆ.

https://t.co/8ipM4QAe8i",7,4,27,0,,"{'urls': [{'start': 23, 'end': 46, 'url': 'https://t.co/8ipM4QAe8i', 'expanded_url': 'https://etherscan.io/tx/0x85b1dad0f9c61f5f6d62488142c084461c54c33b636e3a97109ec2460046f869', 'display_url': 'etherscan.io/tx/0x85b1dad0f…'}]}"
26,1537960583345016833,2022-06-18 00:49:11+00:00,False,https://t.co/PybsfoZV83,11,3,27,3,,"{'urls': [{'start': 0, 'end': 23, 'url': 'https://t.co/PybsfoZV83', 'expanded_url': 'https://twitter.com/i/spaces/1rmxPgAkwYYJN', 'display_url': 'twitter.com/i/spaces/1rmxP…', 'images': [{'url': 'https://pbs.twimg.com/news_img/1537927987735040002/C_3nVAAc?format=jpg&name=orig', 'width': 1200, 'height': 630}, {'url': 'https://pbs.twimg.com/news_img/1537927987735040002/C_3nVAAc?format=jpg&name=150x150', 'width': 150, 'height': 150}], 'status': 200, 'title': 'Scheduled: ʄօʊʀȶɦ ʄʟօօʀ', 'description': 'Tower of the Occult’s space · Where live audio conversations happen', 'unwound_url': 'https://twitter.com/i/spaces/1rmxPgAkwYYJN'}]}"
27,1537957726763880448,2022-06-18 00:37:50+00:00,False,"RT @OccultTowerTeam: The project twitter shared a sneak peak, now its our turn. 

What's this? 🤓 https://t.co/PIeRT5SwXt",16,0,0,0,{'media_keys': ['3_1537957421242384388']},"{'urls': [{'start': 97, 'end': 120, 'url': 'https://t.co/PIeRT5SwXt', 'expanded_url': 'https://twitter.com/OccultTowerTeam/status/1537957564301774850/photo/1', 'display_url': 'pic.twitter.com/PIeRT5SwXt', 'media_key': '3_1537957421242384388'}], 'annotations': [{'start': 33, 'end': 39, 'probability': 0.5041, 'type': 'Product', 'normalized_text': 'twitter'}], 'mentions': [{'start': 3, 'end': 19, 'username': 'OccultTowerTeam', 'id': '1536727727541170176'}]}"
28,1537927986304864256,2022-06-17 22:39:39+00:00,False,"Join the experience.
 https://t.co/PybsfoZV83",15,1,26,1,,"{'urls': [{'start': 22, 'end': 45, 'url': 'https://t.co/PybsfoZV83', 'expanded_url': 'https://twitter.com/i/spaces/1rmxPgAkwYYJN', 'display_url': 'twitter.com/i/spaces/1rmxP…'}]}"
29,1537925493348921344,2022-06-17 22:29:45+00:00,False,ռɨռɛ քʍ ɛֆȶ,12,5,49,0,,
30,1537917502977499138,2022-06-17 21:58:00+00:00,True,https://t.co/mNeq13AJE6,4,1,20,0,{'media_keys': ['3_1537917497269030912']},"{'urls': [{'start': 0, 'end': 23, 'url': 'https://t.co/mNeq13AJE6', 'expanded_url': 'https://twitter.com/OccultTower/status/1537917502977499138/photo/1', 'display_url': 'pic.twitter.com/mNeq13AJE6', 'media_key': '3_1537917497269030912'}]}"
31,1537916934053711877,2022-06-17 21:55:44+00:00,False,ǟ ֆռɛǟӄ քɛɛӄ. https://t.co/Z3V3zWPcqm,18,9,69,2,{'media_keys': ['3_1537916749395308546']},"{'urls': [{'start': 14, 'end': 37, 'url': 'https://t.co/Z3V3zWPcqm', 'expanded_url': 'https://twitter.com/OccultTower/status/1537916934053711877/photo/1', 'display_url': 'pic.twitter.com/Z3V3zWPcqm', 'media_key': '3_1537916749395308546'}]}"
32,1537916587025440770,2022-06-17 21:54:22+00:00,False,RT @BoomBoomNFT: Burned some absolute heaters for @OccultTower last week. Market dumped right after. My bad… https://t.co/m1EFKUJ1Rx,7,0,0,0,{'media_keys': ['3_1537914860339466241']},"{'urls': [{'start': 109, 'end': 132, 'url': 'https://t.co/m1EFKUJ1Rx', 'expanded_url': 'https://twitter.com/BoomBoomNFT/status/1537914866723278848/photo/1', 'display_url': 'pic.twitter.com/m1EFKUJ1Rx', 'media_key': '3_1537914860339466241'}], 'mentions': [{'start': 3, 'end': 15, 'username': 'BoomBoomNFT', 'id': '1456779871494066177'}, {'start': 50, 'end': 62, 'username': 'OccultTower', 'id': '1533184058112454657'}]}"
33,1537849315221049344,2022-06-17 17:27:03+00:00,False,"RT @chainsnfts: Community Giveaway 1x Tower of the Occult
@OccultTower

👇To enter:
Follow @OccultTower 
Like &amp; Retweet this post 
Tag 3 Fri…",47,0,0,0,,"{'mentions': [{'start': 3, 'end': 14, 'username': 'chainsnfts', 'id': '1441861488071692294'}, {'start': 58, 'end': 70, 'username': 'OccultTower', 'id': '1533184058112454657'}, {'start': 90, 'end': 102, 'username': 'OccultTower', 'id': '1533184058112454657'}]}"
34,1537849084333023232,2022-06-17 17:26:08+00:00,False,"RT @metaadventurers: And the deed continues to get done. 4 more…..LET THEM BURN 🔥 @OccultTower @OccultTowerTeam
Burn address: 0x00000000000…",11,0,0,0,,"{'mentions': [{'start': 3, 'end': 19, 'username': 'metaadventurers', 'id': '1394500617943539714'}, {'start': 82, 'end': 94, 'username': 'OccultTower', 'id': '1533184058112454657'}, {'start': 95, 'end': 111, 'username': 'OccultTowerTeam', 'id': '1536727727541170176'}]}"
35,1537844399521923072,2022-06-17 17:07:31+00:00,False,RT @S70N3S: Some of the most fun I've had in the NFT space is @OccultTower. A community driven choose your own adventure driven narrative t…,11,0,0,0,,"{'mentions': [{'start': 3, 'end': 10, 'username': 'S70N3S', 'id': '636563539'}, {'start': 62, 'end': 74, 'username': 'OccultTower', 'id': '1533184058112454657'}]}"
36,1537791021823668224,2022-06-17 13:35:25+00:00,True,"@0xMoist քǟȶɨɛռƈɛ աɨʟʟ ɮɛ ʀɛաǟʀɖɛɖ. 

ʍɨֆȶǟӄɛֆ ɦǟʋɛ ɮɛɛռ ʍǟɖɛ.",3,3,19,0,,"{'mentions': [{'start': 0, 'end': 8, 'username': '0xMoist', 'id': '1133785739169165312'}]}"
37,1537789855286956032,2022-06-17 13:30:46+00:00,False,"ǟɖʋɛռȶʊʀɛʀֆ, ȶօɖǟʏ աɛ ǟֆƈɛռɖ ȶɦʀօʊɢɦ ȶɦɛ ʄօʊʀȶɦ ʄʟօօʀ. ʏօʊ աɨʟʟ ɦǟʋɛ ǟ ɖɛƈɨֆɨօռ ȶօ ʍǟӄɛ.

ǟ ɖɛƈɨֆɨօռ ȶɦǟȶ աօʊʟɖ ɦǟʋɛ ɮɛɛռ ʍʊƈɦ ɛǟֆɨɛʀ ɨʄ ʏօʊ ɦǟɖ ƈɦօֆɛռ ȶօ ɛӼքʟօʀɛ ȶɦɛ ʟɨɮʀǟʀʏ…",22,12,65,1,,
38,1537527583209684992,2022-06-16 20:08:36+00:00,False,"RT @OccultTowerTeam: There will be a snapshot this coming Tuesday, the 21st.

We will not be disclosing the exact time, but will let you wh…",39,0,0,0,,"{'mentions': [{'start': 3, 'end': 19, 'username': 'OccultTowerTeam', 'id': '1536727727541170176'}]}"
39,1537486982288269312,2022-06-16 17:27:16+00:00,False,"ȶօ ǟֆƈɛռɖ ʏօʊ ʍʊֆȶ ֆǟƈʀɨʄɨƈɛ. ȶɦɛ ȶօաɛʀ ʍǟӄɛֆ ռօ ɛӼƈɛքȶɨօռֆ.

ȶɨʍɛ ɨֆ ʀʊռռɨռɢ ֆɦօʀȶ. ֆքʀɛǟɖ ʍʏ աօʀɖ.",28,11,61,1,,
40,1537486414924787712,2022-06-16 17:25:01+00:00,False,"ǟɖʋɛռȶʊʀɛʀֆ, ȶɦɛ ɛȶɛʀռǟʟ ʄʟǟʍɛ ɢʀօաֆ. 

օʋɛʀ ʄɨʋɛ-ɦʊռɖʀɛɖ օƈƈʊʟȶɨֆȶֆ ɦǟʋɛ ɮɛɛռ ֆǟƈʀɨʄɨƈɛɖ. ɨ ǟʍ քʟɛǟֆɛɖ ɮʏ ʏօʊʀ օʄʄɛʀɨռɢֆ.

 ȶɦօֆɛ աɦօ ֆȶօӄɛ ȶɦɛ ʄʟǟʍɛֆ ֆɦǟʟʟ ɮɛ ʀɛաǟʀɖɛɖ.",17,4,44,0,,
41,1537463481385066496,2022-06-16 15:53:53+00:00,True,@Erickan95048502 @MoonPolice2 աɦǟȶ ȶʏքɛ օʄ աɛǟքօռ?,0,1,0,0,,"{'mentions': [{'start': 0, 'end': 16, 'username': 'Erickan95048502', 'id': '1392846291143585792'}, {'start': 17, 'end': 29, 'username': 'MoonPolice2', 'id': '1285556677002039296'}]}"
42,1537431909369667584,2022-06-16 13:48:25+00:00,False,RT @MoonPolice2: With nearly 500 @OccultTower burned and gone forever and staking just around the corner....I wouldn't wait too long to joi…,18,0,0,0,,"{'mentions': [{'start': 3, 'end': 15, 'username': 'MoonPolice2', 'id': '1285556677002039296'}, {'start': 33, 'end': 45, 'username': 'OccultTower', 'id': '1533184058112454657'}]}"
43,1537302049448087552,2022-06-16 05:12:24+00:00,False,"RT @HerbNinjah: ȶɦɛ ȶօաɛʀֆ ʍʏֆȶɛʀɨɛֆ, ֆɦʀօʊɖɛɖ ɨռ ɖǟʀӄռɛֆֆ, ռɛǟʀʟʏ ɖɛʄɛǟȶɨռɢ ǟ ʍǟֆֆɨʋɛ ɮɛǟֆȶ, աɦǟȶ աǟֆ ɨռ ֆȶօʀɛ ʄօʀ ȶɦɛ ǟɖʋɛռȶʊʀɛʀֆ աɦɨʟɛ ȶ…",13,0,0,0,,"{'mentions': [{'start': 3, 'end': 14, 'username': 'HerbNinjah', 'id': '1495058393509285892'}]}"
44,1537275931861012480,2022-06-16 03:28:38+00:00,False,"RT @OccultTowerTeam: Sure!

To unlock the final floor, there will be an additional requirement outside of just burning Occult. It will requ…",21,0,0,0,,"{'mentions': [{'start': 3, 'end': 19, 'username': 'OccultTowerTeam', 'id': '1536727727541170176'}]}"
45,1537253628754464769,2022-06-16 02:00:00+00:00,False,ʄʟօօʀ ʄօʊʀ? https://t.co/8nparEgcIv,23,10,62,2,{'media_keys': ['7_1537252467682992133']},"{'urls': [{'start': 12, 'end': 35, 'url': 'https://t.co/8nparEgcIv', 'expanded_url': 'https://twitter.com/OccultTower/status/1537253628754464769/video/1', 'display_url': 'pic.twitter.com/8nparEgcIv', 'media_key': '7_1537252467682992133'}]}"
46,1537253167565512704,2022-06-16 01:58:10+00:00,False,"ɨֆ ȶɦɛ աօʀʟɖ աǟȶƈɦɨռɢ ʊֆ ɮʊʀռ ʏɛȶ? օʀ, ǟʀɛ աɛ աǟȶƈɦɨռɢ ȶɦɛ աօʀʟɖ ɮʊʀռ?",18,10,66,1,,
47,1537238437773815810,2022-06-16 00:59:38+00:00,False,RT @StrawHatmac: @OccultTower @OccultTowerTeam  y’all got anymore of that lore? https://t.co/hQZplFa4Hg,7,0,0,0,{'media_keys': ['3_1537237881827229696']},"{'urls': [{'start': 80, 'end': 103, 'url': 'https://t.co/hQZplFa4Hg', 'expanded_url': 'https://twitter.com/StrawHatmac/status/1537237884323110912/photo/1', 'display_url': 'pic.twitter.com/hQZplFa4Hg', 'media_key': '3_1537237881827229696'}], 'mentions': [{'start': 3, 'end': 15, 'username': 'StrawHatmac', 'id': '1477064299042455564'}, {'start': 17, 'end': 29, 'username': 'OccultTower', 'id': '1533184058112454657'}, {'start': 30, 'end': 46, 'username': 'OccultTowerTeam', 'id': '1536727727541170176'}]}"
48,1537193783783108608,2022-06-15 22:02:12+00:00,False,"RT @OccultTower: @CullenColors ǟɖʋɛռȶʊʀɛʀ, ȶɦɛ ʊռռǟʍɛɖ աǟʀʀɨօʀ ӄռօաֆ ռօ ʄɛǟʀ օʀ ǟքքʀɛɦɛռֆɨօռ.

ɦɛ աɨʟʟ ռօȶ ʟօֆɛ ɦɨʍֆɛʟʄ ɨռ ȶɦɛ ʍօʍɛռȶ. ɦɛ օ…",13,0,0,0,,"{'mentions': [{'start': 3, 'end': 15, 'username': 'OccultTower', 'id': '1533184058112454657'}, {'start': 17, 'end': 30, 'username': 'CullenColors', 'id': '1055814370582818816'}]}"
49,1537191015211073536,2022-06-15 21:51:12+00:00,True,"@CullenColors ǟɖʋɛռȶʊʀɛʀ, ȶɦɛ ʊռռǟʍɛɖ աǟʀʀɨօʀ ӄռօաֆ ռօ ʄɛǟʀ օʀ ǟքքʀɛɦɛռֆɨօռ.

ɦɛ աɨʟʟ ռօȶ ʟօֆɛ ɦɨʍֆɛʟʄ ɨռ ȶɦɛ ʍօʍɛռȶ. ɦɛ օառֆ ɨȶ.",13,7,52,0,,"{'mentions': [{'start': 0, 'end': 13, 'username': 'CullenColors', 'id': '1055814370582818816'}]}"
50,1537189690788286464,2022-06-15 21:45:56+00:00,False,"ǟɖʋɛռȶʊʀɛʀֆ, աɦǟȶ ƈօʍɛֆ ռɛӼȶ ʍǟʏ ֆʊʀքʀɨֆɛ ʏօʊ. քɛʀɦǟքֆ ɨȶ’ֆ ռօȶ ǟʟʟ ɮǟɖ ɨռ ȶɦɛ ȶօաɛʀ ǟʄȶɛʀ ǟʟʟ.

ǟʀɛ ʏօʊ քʀɛքǟʀɛɖ ȶօ ɛռȶɛʀ ȶɦɛ ʄօʊʀȶɦ ʄʟօօʀ?",26,22,81,1,,
51,1536866023491522560,2022-06-15 00:19:48+00:00,False,"RT @OccultTowerTeam: Adventurers, we are the official team behind Tower of the Occult. We wanted to answer a few basic questions we see con…",35,0,0,0,,"{'annotations': [{'start': 66, 'end': 84, 'probability': 0.669, 'type': 'Other', 'normalized_text': 'Tower of the Occult'}], 'mentions': [{'start': 3, 'end': 19, 'username': 'OccultTowerTeam', 'id': '1536727727541170176'}]}"
52,1536862158310342656,2022-06-15 00:04:26+00:00,False,ȶɦɛ ǟɖʋɛռȶʊʀɛʀֆ ɦǟʋɛ ƈǟʟʟɛɖ ǟ ʍɛɛȶɨռɢ. https://t.co/5776dFueqF,8,2,29,0,,"{'urls': [{'start': 39, 'end': 62, 'url': 'https://t.co/5776dFueqF', 'expanded_url': 'https://twitter.com/IceManCRYPTOS/status/1536860709950214145', 'display_url': 'twitter.com/IceManCRYPTOS/…'}]}"
53,1536820568179154945,2022-06-14 21:19:10+00:00,False,"ǟɖʋɛռȶʊʀɛʀֆ, ɨ ǟʍ քʟɛǟֆɛɖ աɨȶɦ ʏօʊʀ աɨʟʟɨռɢռɛֆֆ ȶօ ֆǟƈʀɨʄɨƈɛ ʄօʀ ȶɦɛ ɛȶɛʀռǟʟ ʄʟǟʍɛ. 

աɛ ɦǟʋɛ ʀɛǟƈɦɛɖ ȶɦɛ ȶɦʀɛֆɦօʟɖ. ֆօօռ աɛ ֆɦǟʟʟ ǟֆƈɛռɖ. 

ȶǟӄɛ ǟ ʄɨռǟʟ ʟօօӄ ǟȶ ȶɦɛ ȶɦɨʀɖ ʄʟօօʀ…. https://t.co/4QvJQ51t54",27,9,80,1,{'media_keys': ['3_1536820564676923392']},"{'urls': [{'start': 180, 'end': 203, 'url': 'https://t.co/4QvJQ51t54', 'expanded_url': 'https://twitter.com/OccultTower/status/1536820568179154945/photo/1', 'display_url': 'pic.twitter.com/4QvJQ51t54', 'media_key': '3_1536820564676923392'}]}"
54,1536809272045998080,2022-06-14 20:34:17+00:00,False,ȶɦɛ ɮɛǟֆȶ ɦǟֆ ʄǟʟʟɛռ. https://t.co/Zh4ArYAWkl,22,6,59,3,"{'media_keys': ['3_1536809241209491456', '3_1536809241238876160']}","{'urls': [{'start': 22, 'end': 45, 'url': 'https://t.co/Zh4ArYAWkl', 'expanded_url': 'https://twitter.com/OccultTower/status/1536809272045998080/photo/1', 'display_url': 'pic.twitter.com/Zh4ArYAWkl', 'media_key': '3_1536809241209491456'}, {'start': 22, 'end': 45, 'url': 'https://t.co/Zh4ArYAWkl', 'expanded_url': 'https://twitter.com/OccultTower/status/1536809272045998080/photo/1', 'display_url': 'pic.twitter.com/Zh4ArYAWkl', 'media_key': '3_1536809241238876160'}]}"
55,1536809012376637440,2022-06-14 20:33:15+00:00,False,"ǟɖʋɛռȶʊʀɛʀֆ, ʍǟռʏ ɖɨɛɖ ɨռ ȶɦɛ ɮǟȶȶʟɛ աɨȶɦ ȶɦɛ ɮɛǟֆȶ. ʄօʀȶʊռǟȶɛʟʏ ʄօʀ ʏօʊ, ʍʏ օառ ʀǟռӄֆ աɛʀɛ ǟʍօռɢ ȶɦɛ ʄʀօռȶ ʟɨռɛֆ ǟռɖ ֆʊʄʄɛʀɛɖ ɦɛǟʋʏ ƈǟֆʊǟʟȶɨɛֆ. ֆɛʋɛռȶʏ-ֆɛʋɛռ օʄ ʍʏ ɮʀǟʋɛ ǟɖʋɛռȶʊʀɛʀֆ ɦǟʋɛ ʝօɨռɛɖ ȶɦɛ ʄʟǟʍɛ.

աɦɛռ ʄօʊʀ-ɦʊռɖʀɛɖ ʄօʀȶʏ-ʄօʊʀ ȶօȶǟʟ ɦǟʋɛ ɮɛɛռ ֆǟƈʀɨʄɨƈɛɖ, աɛ ʍǟʏ քʀօƈɛɛɖ.",21,8,69,2,,
56,1536801030284910594,2022-06-14 20:01:32+00:00,False,https://t.co/wBvvVFJS1F,29,15,63,5,,"{'urls': [{'start': 0, 'end': 23, 'url': 'https://t.co/wBvvVFJS1F', 'expanded_url': 'https://twitter.com/i/spaces/1yoKMWaqXlwJQ', 'display_url': 'twitter.com/i/spaces/1yoKM…'}]}"
57,1536547205259177984,2022-06-14 03:12:56+00:00,False,"ǟɖʋɛռȶʊʀɛʀֆ, ֆքʀɛǟɖ ȶɦɛ աօʀɖ: ʏօʊ աɨʟʟ ռɛɛɖ ǟֆ ʍʊƈɦ ǟֆֆɨֆȶǟռƈɛ ɨռ ȶɦɛ ռɛǟʀ ʄʊȶʊʀɛ. օռɛ ɦʊռɖʀɛɖ ֆɦօʊʟɖ ɖօ.

 https://t.co/wBvvVFJS1F",28,8,58,5,,"{'urls': [{'start': 108, 'end': 131, 'url': 'https://t.co/wBvvVFJS1F', 'expanded_url': 'https://twitter.com/i/spaces/1yoKMWaqXlwJQ', 'display_url': 'twitter.com/i/spaces/1yoKM…'}]}"
